{
  "policy_id": "juno-pm-reference-discovery",
  "policy_version": "1.0.0-draft",
  "promoted_discovery_enabled": false,
  "report_intake_enabled": false,
  "retention": {
    "status": "draft",
    "accepted_report_days": 90,
    "legal_hold_requires_documented_authority": true
  },
  "transitions": [
    {
      "event_id": "evt-market-created",
      "market": { "chain_id": "uni-7", "address": "juno1qqqqqqqqqqqqqqqqqqqqqqqqqqqqqqqqqqqqqq" },
      "from": "Unlisted",
      "to": "Unlisted",
      "visibility": "exact_address_only",
      "quarantined": true,
      "actor_id": "actor-catalog-bot",
      "actor_role": "automation",
      "occurred_at": "2026-07-16T00:00:00Z",
      "reason_code": "pending_review",
      "reason": "Newly activated market is quarantined pending human review.",
      "policy_version": "1.0.0-draft",
      "evidence_refs": ["chain://uni-7/market/juno1qqqqqqqqqqqqqqqqqqqqqqqqqqqqqqqqqqqqqq"]
    },
    {
      "event_id": "evt-initial-listing",
      "market": { "chain_id": "uni-7", "address": "juno1qqqqqqqqqqqqqqqqqqqqqqqqqqqqqqqqqqqqqq" },
      "from": "Unlisted",
      "to": "Listed",
      "visibility": "promoted",
      "quarantined": false,
      "actor_id": "actor-reviewer-alpha",
      "actor_role": "reviewer",
      "occurred_at": "2026-07-16T01:00:00Z",
      "reason_code": "review_passed",
      "reason": "Question, sources, identity, and enhanced-review criteria passed review.",
      "policy_version": "1.0.0-draft",
      "evidence_refs": ["policy://reviews/review-001"]
    },
    {
      "event_id": "evt-appeal-reversal",
      "market": { "chain_id": "uni-7", "address": "juno1qqqqqqqqqqqqqqqqqqqqqqqqqqqqqqqqqqqqqq" },
      "from": "Listed",
      "to": "Warning",
      "visibility": "exact_address_only",
      "quarantined": false,
      "actor_id": "actor-reviewer-beta",
      "actor_role": "appeal_reviewer",
      "occurred_at": "2026-07-16T03:00:00Z",
      "reason_code": "appeal_modified",
      "reason": "Independent appeal review found materially ambiguous source availability.",
      "policy_version": "1.0.0-draft",
      "evidence_refs": ["policy://appeals/appeal-001"],
      "supersedes_event_id": "evt-initial-listing"
    }
  ],
  "reports": [
    {
      "report_id": "rpt-source-access",
      "market": { "chain_id": "uni-7", "address": "juno1qqqqqqqqqqqqqqqqqqqqqqqqqqqqqqqqqqqqqq" },
      "category": "ambiguous_rules",
      "description": "The primary resolution source is not publicly accessible.",
      "evidence_refs": ["https://example.invalid/public-source-status"],
      "submitted_at": "2026-07-16T01:30:00Z",
      "status": "triaged",
      "follow_up_consent": false
    }
  ],
  "appeals": [
    {
      "appeal_id": "apl-listing-001",
      "challenged_event_id": "evt-initial-listing",
      "basis": "The cited source cannot be accessed by ordinary resolvers.",
      "evidence_refs": ["https://example.invalid/public-source-status"],
      "submitted_at": "2026-07-16T02:00:00Z",
      "status": "modified",
      "reviewer_actor_id": "actor-reviewer-beta",
      "decided_at": "2026-07-16T03:00:00Z",
      "disposition_transition_id": "evt-appeal-reversal",
      "rationale": "Independent review requires an exact-address warning until a public source exists."
    }
  ]
}
